{
  "id": "bahrain-victorious-2026-home",
  "clubId": "bahrain-victorious",
  "season": "2026",
  "kitType": "home",
  "periodLabel": "2026 season",
  "periodFrom": "2026",
  "periodTo": "2026",
  "photos": {},
  "sponsors": [
    {
      "sponsorId": "bahrain-economic-development-board",
      "placement": "front",
      "source": {
        "name": "Team Bahrain Victorious: Bahrain Victorious Unveils 2026 Alé Team Kit",
        "date": "2026-01-02",
        "url": "https://bahraincyclingteam.com/bahrain-victorious-unveils-2026-ale-team-kit",
        "quote": "Team Bahrain Victorious today presents its new Alé team kit",
        "checked": {
          "on": "2026-09-29",
          "by": "Schnitzel"
        },
        "note": "The launch photo (https://bahraincyclingteam.com/wp-content/uploads/2026/01/CL_BAH_141225_studio-108-1.jpg) shows the 'Business Friendly Bahrain' mark on the upper chest; Alé's render in TOUR's article (https://res.cloudinary.com/delius-klasing-eu/image/upload/v1767869731/tour/ale-team-bahrain-victorious-new-kit-2026_321736fbbe36141263f9ccc96296f427.jpg) shows it on both sides of the chest. The team's About page lists the Bahrain Economic Development Board among its backers."
      }
    },
    {
      "sponsorId": "mumtalakat",
      "placement": "front",
      "source": {
        "name": "Team Bahrain Victorious — About Us",
        "date": "2026",
        "url": "https://bahraincyclingteam.com/about/",
        "quote": "proud and continued support of the Bahrain Economic Development Board, Mumtalakat, Bapco Energies, Beyon, National Bank of Bahrain (BBK), Al Salam Bank, Alba",
        "checked": {
          "on": "2026-09-29",
          "by": "btj-researcher (OpenCode, model kimi-k3, run by @Schnitzel)"
        },
        "note": "Placement not confirmed on the launch photos and renders checked (front and sleeves; no back view found). The About page names Mumtalakat among the team's backers."
      }
    },
    {
      "sponsorId": "bapco-energies",
      "placement": "front",
      "source": {
        "name": "Velopack: Un maillot 2026 identitaire pour Bahrain Victorious",
        "date": "2026-01-02",
        "url": "https://www.velopack.fr/17723-bahrain-victorious-devoile-un-maillot-2026-ancre-dans-lhistoire",
        "quote": "la visibilité du sponsor principal Bapco Energies",
        "checked": {
          "on": "2026-09-29",
          "by": "Schnitzel"
        },
        "note": "The team's launch photo (https://bahraincyclingteam.com/wp-content/uploads/2026/01/CL_BAH_141225_studio-96.jpg) shows Bapco Energies across the lower front."
      }
    },
    {
      "sponsorId": "beyon",
      "placement": "front",
      "source": {
        "name": "TOUR: Shirt presentation 2026: Bahrain-Victorious wears dark blue and celeste",
        "date": "2026-01-11",
        "url": "https://www.tour-magazin.de/en/professional-cycling/latest-news/shirt-presentation-2026-bahrain-victorious-wears-dark-blue-and-celeste/",
        "quote": "Bahrain-Victorious has presented its new jersey for the coming season. The Italian manufacturer Alé remains the outfitter.",
        "checked": {
          "on": "2026-09-29",
          "by": "Schnitzel"
        },
        "note": "Alé's render in the article (https://res.cloudinary.com/delius-klasing-eu/image/upload/v1767869731/tour/ale-team-bahrain-victorious-new-kit-2026_321736fbbe36141263f9ccc96296f427.jpg) shows BEYON on the upper chest, beside NBB; so does the team's launch photo (https://bahraincyclingteam.com/wp-content/uploads/2026/01/CL_BAH_141225_studio-96.jpg)."
      }
    },
    {
      "sponsorId": "national-bank-of-bahrain",
      "placement": "front",
      "source": {
        "name": "TOUR: Shirt presentation 2026: Bahrain-Victorious wears dark blue and celeste",
        "date": "2026-01-11",
        "url": "https://www.tour-magazin.de/en/professional-cycling/latest-news/shirt-presentation-2026-bahrain-victorious-wears-dark-blue-and-celeste/",
        "quote": "Bahrain-Victorious has presented its new jersey for the coming season. The Italian manufacturer Alé remains the outfitter.",
        "checked": {
          "on": "2026-09-29",
          "by": "Schnitzel"
        },
        "note": "Alé's render in the article (https://res.cloudinary.com/delius-klasing-eu/image/upload/v1767869731/tour/ale-team-bahrain-victorious-new-kit-2026_321736fbbe36141263f9ccc96296f427.jpg) shows NBB and its Arabic logo on the upper chest, beside BEYON; so does the team's launch photo (https://bahraincyclingteam.com/wp-content/uploads/2026/01/CL_BAH_141225_studio-96.jpg)."
      }
    },
    {
      "sponsorId": "al-salam-bank",
      "placement": "sleeve",
      "source": {
        "name": "Team Bahrain Victorious: Bahrain Victorious Unveils 2026 Alé Team Kit",
        "date": "2026-01-02",
        "url": "https://bahraincyclingteam.com/bahrain-victorious-unveils-2026-ale-team-kit",
        "quote": "Team Bahrain Victorious today presents its new Alé team kit",
        "checked": {
          "on": "2026-09-29",
          "by": "Schnitzel"
        },
        "note": "The launch photo (https://bahraincyclingteam.com/wp-content/uploads/2026/01/CL_BAH_141225_studio-108-1.jpg) shows 'Al Salam Bank' with its Arabic name on the sleeve, under OMNIYAT."
      }
    },
    {
      "sponsorId": "alba",
      "placement": "front",
      "source": {
        "name": "TOUR: Shirt presentation 2026: Bahrain-Victorious wears dark blue and celeste",
        "date": "2026-01-11",
        "url": "https://www.tour-magazin.de/en/professional-cycling/latest-news/shirt-presentation-2026-bahrain-victorious-wears-dark-blue-and-celeste/",
        "quote": "Bahrain-Victorious has presented its new jersey for the coming season. The Italian manufacturer Alé remains the outfitter.",
        "checked": {
          "on": "2026-09-29",
          "by": "Schnitzel"
        },
        "note": "Alé's render in the article (https://res.cloudinary.com/delius-klasing-eu/image/upload/v1767869731/tour/ale-team-bahrain-victorious-new-kit-2026_321736fbbe36141263f9ccc96296f427.jpg) shows 'alba, Aluminium for the world' on the right side of the collar."
      }
    },
    {
      "sponsorId": "omniyat",
      "placement": "sleeve",
      "source": {
        "name": "Team Bahrain Victorious — Bahrain Victorious Unveils 2026 Alé Team Kit",
        "date": "2026-01-02",
        "url": "https://bahraincyclingteam.com/bahrain-victorious-unveils-2026-ale-team-kit",
        "quote": "with new partner OMNIYAT featured on the sleeves and side of the jersey for the 2026 season",
        "checked": {
          "on": "2026-09-29",
          "by": "btj-researcher (OpenCode, model kimi-k3, run by @Schnitzel)"
        }
      }
    },
    {
      "sponsorId": "bianchi",
      "placement": "partner",
      "source": {
        "name": "Cyclingnews — Bahrain Victorious announce 2026 bike sponsor (Tom Wieckowski)",
        "date": "2025-12-04",
        "url": "https://www.cyclingnews.com/bikes/pro-bikes/bahrain-victorious-announces-2026-bike-sponsor",
        "quote": "Bahrain Victorious have partnered with Bianchi as the official bike supplier for the 2026 racing season and beyond",
        "checked": {
          "on": "2026-09-29",
          "by": "btj-researcher (OpenCode, model kimi-k3, run by @Schnitzel)"
        }
      }
    }
  ],
  "sponsorsComplete": false,
  "summary": "2026 UCI WorldTeam kit by Alé, with BAHRAIN VICTORIOUS across the chest. From the launch photos: Bapco Energies on the front, BEYON and NBB on the upper chest, 'Business Friendly Bahrain' on the chest, alba on the collar, OMNIYAT on the sides and sleeves, Al Salam Bank on the sleeves, Bianchi on the chest and sleeves. Not complete: no back view was found, Mumtalakat's place isn't confirmed, and the United Shipping mark on the chest and further partners (Rudy Project, Vision, Continental and others) aren't itemised.",
  "change": null
}
