{
  "id": "philadelphia-eagles-2026-27-home",
  "clubId": "philadelphia-eagles",
  "season": "2026-27",
  "kitType": "home",
  "periodLabel": "2026/27",
  "periodFrom": "2026-27",
  "periodTo": "2026-27",
  "photos": {},
  "sponsors": [
    {
      "sponsorId": "jefferson-health",
      "placement": "training-kit",
      "source": {
        "name": "Philadelphia Eagles (philadelphiaeagles.com) – Eagles announce expanded healthcare partnerships with Jefferson Health and Select Medical's NovaCare Rehabilitation",
        "date": "2026-02-17",
        "url": "https://www.philadelphiaeagles.com/news/eagles-announce-expanded-healthcare-partnerships-jefferson-health-novacare-rehabilitation",
        "quote": "will continue to serve as the patch sponsor of the team's practice jerseys",
        "checked": {
          "on": "2026-10-01",
          "by": "btj-researcher (OpenCode, model deepseek-v4.1-flash-uncensored-fp8, run by @Schnitzel)"
        }
      }
    }
  ],
  "sponsorsComplete": true,
  "summary": "Practice-jersey patch: Jefferson Health.",
  "change": null
}
