{
  "id": "rubin-kazan-2026-27-home",
  "clubId": "rubin-kazan",
  "season": "2026-27",
  "kitType": "home",
  "periodLabel": "2026/27",
  "periodFrom": "2026-27",
  "periodTo": "2026-27",
  "photos": {},
  "sponsors": [
    {
      "sponsorId": "kazanorgsintez",
      "placement": "front",
      "source": {
        "name": "FC Rubin – Partners",
        "date": "2026-09-25",
        "url": "https://www.rubin-kazan.ru/club/partners/",
        "note": "Казаньоргсинтез — Генеральный спонсор."
      }
    }
  ],
  "sponsorsComplete": false,
  "summary": "Kazanorgsintez general sponsor; shirt placement not confirmed against a kit launch.",
  "change": null
}
