{
  "id": "academico-de-viseu-2026-27-home",
  "clubId": "academico-de-viseu",
  "season": "2026-27",
  "kitType": "home",
  "periodLabel": "2026/27",
  "periodFrom": "2026-27",
  "periodTo": "2026-27",
  "photos": {},
  "sponsors": [
    {
      "sponsorId": "visabeira",
      "placement": "front",
      "source": {
        "name": "Académico de Viseu: Equipamento principal 2026/27: “Do nosso Interior, vivemos a glória”",
        "date": "2026-07-28",
        "url": "https://academicodeviseu.pt/noticia.php?n=1345",
        "quote": "O regresso do logótipo da Visabeira à zona do abdómen recupera um momento do qual só os mais antigos se lembram",
        "checked": {
          "on": "2026-09-28",
          "by": "Schnitzel"
        }
      }
    },
    {
      "sponsorId": "dazn",
      "placement": "sleeve",
      "source": {
        "name": "O Jogo: Académico de Viseu revela mais dois jogos de preparação",
        "date": "2026-07-13",
        "url": "https://www.ojogo.pt/futebol/artigo/academico-de-viseu-anuncia-parceria-com-dazn/18105579",
        "quote": "uma parceria com a DAZN, marca presente que se fará notar na manga esquerda dos novos equipamentos",
        "checked": {
          "on": "2026-09-28",
          "by": "Schnitzel"
        },
        "note": "The club's own announcement of the same day (https://academicodeviseu.pt/noticia.php?n=1332) puts the DAZN brand on its match shirts; O Jogo names the left sleeve."
      }
    },
    {
      "sponsorId": "joma",
      "placement": "partner",
      "source": {
        "name": "Footy Headlines: Académico de Viseu 26-27 Liga Portugal Home, Away and Third Kits Released",
        "date": "2026-07-30",
        "url": "https://www.footyheadlines.com/4191948506/academico-de-viseu-26-27-liga-portugal-home-away-and-third-kits-released.html",
        "quote": "This is the Académico de Viseu 26-27 home shirt, made by Joma.",
        "checked": {
          "on": "2026-09-28",
          "by": "Schnitzel"
        },
        "note": "Kit maker. The club renewed its Joma deal to 2028/29 (https://academicodeviseu.pt/noticia.php?n=986)."
      }
    }
  ],
  "sponsorsComplete": false,
  "summary": "Joma-made home shirt with Visabeira's logo back on the front and DAZN on the left sleeve. Not marked complete: only Wikipedia's kit table lists the other placements (Buondi on the front, Visipapel and Quinta de Lemos on the back, Águas do Caramulo and 2PLAY on the shorts), and no club announcement or news article found names them on the 2026-27 shirt.",
  "change": null
}
