{
  "id": "arizona-cardinals-2026-27-home",
  "clubId": "arizona-cardinals",
  "season": "2026-27",
  "kitType": "home",
  "periodLabel": "2026/27",
  "periodFrom": "2026-27",
  "periodTo": "2026-27",
  "photos": {},
  "sponsors": [
    {
      "sponsorId": "desert-financial-credit-union",
      "placement": "training-kit",
      "source": {
        "name": "Arizona Cardinals – Cardinals, Desert Financial Announce Details Of New Partnership",
        "date": "2024-09-10",
        "url": "https://www.azcardinals.com/news/cardinals-desert-financial-announce-details-of-new-partnership",
        "quote": "the Desert Financial Credit Union logo will now be prominently displayed on Cardinals practice jerseys worn throughout the year.",
        "checked": {
          "on": "2026-10-01",
          "by": "btj-researcher (OpenCode, model deepseek-v4.1-flash-uncensored-fp8, run by @Schnitzel)"
        }
      }
    }
  ],
  "sponsorsComplete": false,
  "summary": "Practice-jersey patch: Desert Financial Credit Union.",
  "change": null
}
