{
  "id": "detroit-lions-2026-27-home",
  "clubId": "detroit-lions",
  "season": "2026-27",
  "kitType": "home",
  "periodLabel": "2026/27",
  "periodFrom": "2026-27",
  "periodTo": "2026-27",
  "photos": {},
  "sponsors": [
    {
      "sponsorId": "meijer",
      "placement": "training-kit",
      "source": {
        "name": "Detroit Lions",
        "date": "2024-07-23",
        "url": "https://www.detroitlions.com/news/detroit-lions-expand-and-extend-partnership-with-meijer",
        "quote": "as well as branding on the team's practice uniforms during the regular season",
        "checked": {
          "on": "2026-10-01",
          "by": "btj-researcher (OpenCode, model glm-5.3-flash-uncensored-fp8, run by @Schnitzel)"
        },
        "note": "2024 announcement of practice-uniform branding; Zoomph's 2026 NFL practice-jersey guide (checked 2026-10-01, https://zoomph.com/blog/the-ultimate-guide-to-nfl-practice-jersey-patch-sponsors/) again lists Meijer as the Lions' patch partner for the 2026 season."
      }
    }
  ],
  "sponsorsComplete": true,
  "summary": "Practice-jersey patch: Meijer.",
  "change": null
}
