{
  "id": "olympiacos-2026-27-home",
  "clubId": "olympiacos",
  "season": "2026-27",
  "kitType": "home",
  "periodLabel": "2026/27",
  "periodFrom": "2026-27",
  "periodTo": "2026-27",
  "photos": {},
  "sponsors": [
    {
      "sponsorId": "superbet",
      "placement": "front",
      "source": {
        "name": "Sport24, 'Superbet kai Olympiakos mazi mechri to 2032' (Superbet and Olympiacos together until 2032)",
        "date": "2026-07-03",
        "url": "https://www.sport24.gr/basket/superbet-kai-olimpiakos-mazi-mexri-to-2032/",
        "note": "Superbet is the 'Great Sponsor' until 2032; deal reportedly worth EUR 55m including bonuses"
      }
    }
  ],
  "sponsorsComplete": false,
  "summary": "Superbet front-of-shirt from 2026, deal to 2032.",
  "change": null
}
