{
  "id": "tottenham-hotspur-w-2026-27-home",
  "clubId": "tottenham-hotspur-w",
  "season": "2026-27",
  "kitType": "home",
  "periodLabel": "2026/27",
  "periodFrom": "2026-27",
  "periodTo": "2026-27",
  "photos": {},
  "sponsors": [
    {
      "sponsorId": "aia",
      "placement": "front",
      "source": {
        "name": "Sportcal: Spurs set for new front-of-shirt sponsor as AIA pivots to training kit",
        "date": "2025-11-04",
        "url": "https://www.sportcal.com/news/spurs-set-for-new-front-of-shirt-sponsor-as-aia-pivots-to-training-kit",
        "note": "Front-of-shirt deal is club-wide and runs through 2026/27. The club's Women's Team Partners page (checked 2026-09-30) lists AIA as Global Principal Partner, and the club's 19 Jun 2026 kit gallery describes 'the home shirt our teams will wear for the 2026/27 season'.",
        "quote": "AIA\u2019s logo has featured on the front of Spurs\u2019 home shirts for a decade under a \u00a3320 million ($400 million), \u00a340 million per year deal running through the 2026-27 season",
        "checked": {
          "on": "2026-09-30",
          "by": "btj-researcher (OpenCode, model kimi-k3, run by @Schnitzel)"
        }
      }
    },
    {
      "sponsorId": "kraken",
      "placement": "sleeve",
      "source": {
        "name": "Tottenham Hotspur – 'Tottenham Hotspur partners with Crypto Platform Kraken'",
        "date": "2024-07-16",
        "url": "https://www.tottenhamhotspur.com/news/2024/july/tottenham-hotspur-partners-with-crypto-platform-kraken",
        "note": "Club-wide sleeve deal from 2024/25; the club's Women's Team Partners page (checked 2026-09-30) still lists Kraken as Official Sleeve Partner.",
        "quote": "the Official Sleeve Partner for our Men's and Women's teams",
        "checked": {
          "on": "2026-09-30",
          "by": "btj-researcher (OpenCode, model kimi-k3, run by @Schnitzel)"
        }
      }
    },
    {
      "sponsorId": "elf-cosmetics",
      "placement": "back",
      "source": {
        "name": "Tottenham Hotspur – 'Tottenham Hotspur Women Announces Partnership with e.l.f. Cosmetics'",
        "date": "2025-09-04",
        "url": "https://www.tottenhamhotspur.com/news/984446/tottenham-hotspur-women-announces-partnership-with-elf-cosmetics",
        "note": "Announced ahead of the 2025/26 WSL season; the club's Women's Team Partners page (checked 2026-09-30) still lists e.l.f. ('Eyes. Lips. Face') as Official Back of Shirt Partner, confirming it continues in 2026/27.",
        "quote": "sees the brand become the new Official Back of Shirt Partner of Tottenham Hotspur Women",
        "checked": {
          "on": "2026-09-30",
          "by": "btj-researcher (OpenCode, model kimi-k3, run by @Schnitzel)"
        }
      }
    },
    {
      "sponsorId": "nike",
      "placement": "partner",
      "source": {
        "name": "Tottenham Hotspur – 'Gallery: New Nike 2026/27 Home Kit up close'",
        "date": "2026-06-19",
        "url": "https://www.tottenhamhotspur.com/news/1074148/gallery-new-nike-202627-home-kit-up-close",
        "note": "Club kit launch for 2026/27 covering both teams ('our teams'); the Women's Team Partners page lists Nike as Official Kit Provider.",
        "quote": "Here's a closer look at the home shirt our teams will wear for the 2026/27 season. Classic Lilywhite, our Nike Home shirt is our nod to our heritage",
        "checked": {
          "on": "2026-09-30",
          "by": "btj-researcher (OpenCode, model kimi-k3, run by @Schnitzel)"
        }
      }
    }
  ],
  "sponsorsComplete": true,
  "summary": "2026/27 home shirt: Nike kit (partner), AIA front-of-shirt, Kraken sleeve, e.l.f. Cosmetics back-of-shirt. No shorts sponsor documented (Wikipedia's 2026–27 WSL kits table lists none).",
  "change": null
}
