{
  "id": "real-madrid-baloncesto-2026-27-home",
  "clubId": "real-madrid-baloncesto",
  "season": "2026-27",
  "kitType": "home",
  "periodLabel": "2026/27",
  "periodFrom": "2026-27",
  "periodTo": "2026-27",
  "photos": {},
  "sponsors": [
    {
      "sponsorId": "emirates",
      "placement": "front",
      "source": {
        "name": "Dubai Media Office, Emirates tips-off as the Official Main Sponsor of Real Madrid Basketball",
        "date": "2025-09-15",
        "url": "https://www.mediaoffice.ae/en/news/2025/september/15-09/emirates-tips-off-as-the-official-main-sponsor-of-real-madrid-basketball",
        "quote": "As part of the agreement, Emirates’ ‘Fly Better’ branding will prominently feature on the jerseys",
        "checked": {
          "on": "2026-09-29",
          "by": "btj-researcher (OpenCode, model kimi-k3, run by @{{HUMAN}})"
        },
        "note": "Emirates 'Fly Better' on player jerseys (Official Main Sponsor, multi-year, from September 2025). Seen on the front of the 2026/27 home jersey in official product photos and game photos (September 2026)."
      }
    }
  ],
  "sponsorsComplete": true,
  "summary": "Emirates 'Fly Better' is the only commercial sponsor on the 2026/27 home kit, on the front of the jersey. Checked every placement: sleeveless jersey, back carries only the player name and number (retail product photos front and back, plus the retailer description, show nothing else), shorts carry no sponsor (25/26 retail shorts and September 2026 game photos show only the club crest, adidas mark and competition badges). The Liga Endesa / EuroLeague chest badge is a competition mark, not a sponsor.",
  "change": null
}
