{
  "id": "hamburger-sv-2026-27-home",
  "clubId": "hamburger-sv",
  "season": "2026-27",
  "kitType": "home",
  "periodLabel": "2026/27",
  "periodFrom": "2026-27",
  "periodTo": "2026-27",
  "photos": {
    "back": "assets/shirts/hamburger-sv/2026-27-home-back.jpg",
    "front": "assets/shirts/hamburger-sv/2026-27-home-front.jpg",
    "square": "assets/shirts/grid/hamburger-sv-2026-27-home-front-square.jpg"
  },
  "sponsors": [
    {
      "sponsorId": "hansemerkur",
      "placement": "front",
      "source": {
        "name": "Deutsches Institut fuer Marketing, Trikotsponsoren der Bundesliga (stand 4 Aug 2026)",
        "date": "2026-08-04",
        "url": "https://www.marketinginstitut.biz/blog/trikotsponsoren-bundesliga/"
      }
    },
    {
      "sponsorId": "helm-ag",
      "placement": "sleeve",
      "side": "front",
      "source": {
        "name": "11+ Media, Sponsoring in der Bundesliga (Ärmelpartner, 2025/26 season)",
        "date": "2025-26",
        "url": "https://www.11plusmedia.com/blog/sponsoring-in-der-bundesliga/"
      }
    }
  ],
  "sponsorsComplete": false,
  "summary": null,
  "change": null
}