{
  "id": "new-york-giants-2026-27-home",
  "clubId": "new-york-giants",
  "season": "2026-27",
  "kitType": "home",
  "periodLabel": "2026/27",
  "periodFrom": "2026-27",
  "periodTo": "2026-27",
  "photos": {},
  "sponsors": [
    {
      "sponsorId": "quest-diagnostics",
      "placement": "training-kit",
      "source": {
        "name": "Zoomph - NFL Practice Jersey Sponsor Guide (updated 2026-09-01)",
        "date": "2026-09-01",
        "url": "https://zoomph.com/blog/the-ultimate-guide-to-nfl-practice-jersey-patch-sponsors/",
        "quote": "Quest Diagnostics continues its partnership with the Giants, emphasizing data-driven health and wellness across the organization.",
        "checked": {
          "on": "2026-10-01",
          "by": "btj-researcher (OpenCode, model glm-5.3-flash-uncensored-fp8, run by @Schnitzel)"
        }
      }
    }
  ],
  "sponsorsComplete": true,
  "summary": "Practice-jersey patch: Quest Diagnostics.",
  "change": null
}
